[
  {
    "schemaVersion": 1,
    "id": "arrival",
    "title": "Первые следы",
    "description": "Первые уровни дают звёзды для восстановления вестибюля.",
    "levelIds": [1, 2, 3],
    "unlock": { "type": "always" }
  },
  {
    "schemaVersion": 1,
    "id": "whispers",
    "title": "Шёпот особняка",
    "description": "Зажгите люстру в Вестибюле, чтобы открыть составные цели, цепи и завалы.",
    "levelIds": [4, 5, 6],
    "unlock": {
      "type": "restoration-task",
      "taskId": "hall-light-chandelier"
    }
  },
  {
    "schemaVersion": 1,
    "id": "deepening-mystery",
    "title": "Тайна сгущается",
    "description": "Почините стеллажи Библиотеки, чтобы открыть туман и сложные формы поля.",
    "levelIds": [7, 8, 9],
    "unlock": {
      "type": "restoration-task",
      "taskId": "library-repair-shelves"
    }
  },
  {
    "schemaVersion": 1,
    "id": "prototype-finale",
    "title": "Финал прототипа",
    "description": "Почините фонтан Зимнего сада, чтобы открыть итоговое испытание.",
    "levelIds": [10],
    "unlock": {
      "type": "restoration-task",
      "taskId": "garden-repair-fountain"
    }
  }
]
